lesson_number,order_index,domain,difficulty,title,module,topics,prerequisites,status,course_tag,notes
88,20,malware,2,Malware Sandboxing and Automated Analysis,Module 4: Analysis Automation,"Cuckoo Sandbox setup and configuration, CAPE Sandbox, Joe Sandbox, automated behavioral analysis, report interpretation, evasion detection, YARA integration","[1,2]",completed,,Automation and scalability
89,59,active_directory,3,Azure AD and Hybrid Identity Attacks,Module 4: Cloud AD,"Azure AD fundamentals, Pass-the-PRT attacks, OAuth token theft, conditional access bypass, Azure AD Connect exploitation, hybrid identity attacks","[1,2,3,4,5]",completed,,Modern cloud-integrated AD attacks
90,60,active_directory,3,AD CS Template Abuse and ESC Vulnerabilities,Module 5: Advanced Exploitation,"Certificate Services exploitation, ESC1-ESC8 vulnerabilities, certificate template abuse, Certipy tool, privilege escalation via certificates",[8],completed,,Certificate Services attacks
91,61,active_directory,3,NTLM Relay and Coercion Attacks,Module 5: Advanced Exploitation,"NTLM relay fundamentals, PetitPotam, PrinterBug, DFSCoerce, ShadowCoerce, relay to LDAP/SMB/HTTP, mitigation and detection","[4,5]",completed,,Coercion and relay techniques
92,62,active_directory,3,Shadow Credentials and Key Trust Attacks,Module 5: Advanced Exploitation,"Shadow Credentials attack, KeyList attribute abuse, PKINIT authentication, Whisker tool, certificate-based authentication exploitation",[60],completed,,Advanced certificate attacks
93,63,active_directory,3,Active Directory Federation Services Attacks,Module 5: Advanced Exploitation,"AD FS architecture, Golden SAML attacks, token signing certificate theft, federation trust abuse, Azure AD integration attacks",[59],completed,,Federation services exploitation
94,64,active_directory,3,LAPS and Credential Guard Bypass,Module 5: Advanced Exploitation,"LAPS architecture and bypass techniques, Credential Guard overview, credential dumping with protections enabled, alternative credential sources","[4,5]",completed,,Bypassing modern defenses
95,65,active_directory,3,Domain Dominance and Advanced Persistence,Module 6: Persistence,"DCShadow for stealthy replication, AdminSDHolder abuse, Skeleton Key malware, DSRM password abuse, SID History injection","[1,2,3,4,5,6,7]",completed,,Advanced persistence mechanisms
96,66,active_directory,3,AD Recovery and Post-Breach Remediation,Module 6: Persistence,"Incident response in AD, removing persistence, credential rotation, detecting backdoors, forest recovery, lessons from real breaches",[65],completed,,Defensive and recovery focus
97,13,linux,2,Linux Security Hardening,Module 2: Security,"SELinux policies and enforcement, AppArmor profiles, CIS benchmarks, kernel hardening (sysctl), secure boot, firewall configuration (iptables, nftables)","[1,2,3,4,5]",completed,,Defensive hardening techniques
98,14,linux,3,Docker and Container Security,Module 3: Containers,"Docker security best practices, image scanning (Trivy, Clair), runtime security (Falco), seccomp profiles, capability management, rootless containers",[13],completed,,Container security focus
99,15,linux,3,Kubernetes Security Architecture,Module 3: Containers,"Kubernetes RBAC, pod security policies/standards, network policies, admission controllers, secrets management, service mesh security (Istio)",[14],completed,,K8s security deep dive
100,16,linux,3,Linux Rootkit Detection and Analysis,Module 4: Threat Detection,"Kernel module rootkits, LD_PRELOAD rootkits, user-mode rootkits, detection with rkhunter/chkrootkit, memory analysis for rootkits, behavioral indicators","[1,13]",completed,,Advanced threat detection
101,13,fundamentals,1,Security Compliance Frameworks Overview,Module 3: Governance,"ISO 27001/27002, SOC 2 Type I/II, PCI-DSS, HIPAA, GDPR, NIST frameworks, compliance vs security, audit preparation","[1,2,3]",completed,,Foundation for GRC career path
102,14,fundamentals,2,Risk Management and Assessment,Module 3: Governance,"Risk identification and analysis, quantitative vs qualitative risk assessment, risk treatment strategies, risk registers, business impact analysis (BIA)",[13],completed,,Risk management fundamentals
103,15,fundamentals,2,Security Audit and Assessment Methodologies,Module 3: Governance,"Vulnerability assessment vs penetration testing, security control testing, evidence collection, audit documentation, remediation tracking","[13,14]",completed,,Audit and assessment skills
104,52,blue_team,2,Sigma Rule Development,Module 4: Detection Engineering,"Sigma rule format and structure, detection logic, field mappings, rule modifiers, conversion to SIEM queries, rule testing and validation","[1,2,3]",completed,,Universal detection rule format
105,53,blue_team,2,YARA Rule Creation for Defense,Module 4: Detection Engineering,"YARA syntax and rule structure, string patterns, conditions, malware detection rules, memory scanning, performance optimization, false positive reduction",[52],completed,,Malware and IOC detection
106,54,blue_team,3,Custom EDR Detection Development,Module 4: Detection Engineering,"Behavioral detections, telemetry analysis, EDR query languages, detection logic trees, combining multiple data sources, detection tuning","[52,6]",completed,,Advanced detection creation
107,55,blue_team,3,Detection Engineering Metrics and Testing,Module 4: Detection Engineering,"Detection coverage measurement, false positive rate, mean time to detect (MTTD), ATT&CK coverage mapping, A/B testing detections, detection validation",[54],completed,,Measuring detection effectiveness
108,56,blue_team,2,Threat Intelligence for Detection,Module 5: Threat Intelligence,"IOC integration, TIP platforms (MISP, OpenCTI), threat intelligence enrichment, converting CTI to detections, intelligence-driven defense","[1,52]",completed,,CTI and detection integration
109,16,osint,2,Threat Intelligence Platforms,Module 3: Threat Intelligence,"TIP overview, MISP installation and usage, OpenCTI, ThreatConnect, IOC management, intelligence sharing communities, feed integration","[1,2,3]",completed,,TIP fundamentals
110,17,osint,2,STIX TAXII and Intelligence Sharing,Module 3: Threat Intelligence,"STIX format (observables, indicators, TTPs), TAXII protocol, intelligence sharing standards, creating STIX bundles, consuming threat feeds",[16],completed,,Standardized threat intelligence
111,18,osint,3,Adversary Infrastructure Tracking,Module 3: Threat Intelligence,"Passive DNS analysis, certificate transparency logs, domain registration tracking, IP reputation, infrastructure pivoting, tools (SecurityTrails, Censys, Shodan)","[1,7]",completed,,Infrastructure intelligence
112,19,osint,3,Malware Intelligence and Campaign Tracking,Module 3: Threat Intelligence,"Malware family tracking, campaign attribution, C2 infrastructure mapping, malware configuration extraction, correlating attacks, threat actor profiling","[18,43]",completed,,Malware threat intelligence
113,20,osint,3,OSINT to Detection Pipeline,Module 3: Threat Intelligence,"Converting OSINT findings to IOCs, automating intelligence ingestion, enriching alerts with OSINT, intelligence-driven hunting, feedback loops","[16,17,18,19]",completed,,Operationalizing OSINT
114,1,ai_security,2,Machine Learning Security Fundamentals,Module 1: AI/ML Security,"ML pipeline security, adversarial ML overview, model poisoning, data poisoning, training data security, model theft",[],completed,,New domain: AI/ML Security
115,2,ai_security,3,AI ML Model Attacks and Defense,Module 1: AI/ML Security,"Evasion attacks (FGSM, PGD), adversarial examples, backdoor attacks, model inversion, membership inference, defenses and robustness",[1],completed,,Attack techniques on ML models
116,3,ai_security,3,LLM Security and Prompt Injection,Module 1: AI/ML Security,"OWASP LLM Top 10, prompt injection attacks, jailbreaking techniques, indirect prompt injection, data leakage, insecure plugins, supply chain risks",[1],completed,,Large Language Model security
117,1,iot_security,2,IoT Security Fundamentals,Module 1: IoT Security,"IoT architecture, protocols (MQTT, CoAP, Zigbee), firmware analysis, hardware hacking basics, UART/JTAG debugging, IoT attack surface",[],completed,,New domain: IoT/OT Security
118,2,iot_security,3,Industrial Control Systems Security,Module 2: OT Security,"ICS/SCADA architecture, Modbus protocol, S7comm (Siemens), DNP3, OT network segmentation, ICS vulnerabilities, Stuxnet case study",[1],completed,,Critical infrastructure security
119,3,iot_security,3,OT Network Monitoring and Detection,Module 2: OT Security,"Zeek for ICS protocol analysis, anomaly detection in OT, passive monitoring, ICS honeypots, detecting unauthorized changes, safety system monitoring",[2],completed,,Detection in OT environments
120,4,iot_security,3,IoT Penetration Testing,Module 3: IoT Testing,"Firmware extraction and analysis, hardware debugging interfaces, RF protocol analysis, mobile app testing, cloud API testing, IoT botnet analysis",[1],completed,,Comprehensive IoT testing
121,1,web3_security,3,Smart Contract Security,Module 1: Web3 Security,"Solidity programming, reentrancy attacks, integer overflow/underflow, flash loan attacks, access control vulnerabilities, tools (Slither, Mythril, Echidna)",[],completed,,New domain: Web3 Security
122,2,web3_security,3,DeFi Security and Exploit Analysis,Module 1: Web3 Security,"DeFi protocols overview, major hack case studies (DAO, Poly Network, Ronin Bridge), oracle manipulation, MEV attacks, rug pulls, security auditing",[1],completed,,DeFi threat landscape
123,3,web3_security,2,NFT and Crypto Wallet Security,Module 1: Web3 Security,"Wallet types (hot vs cold), seed phrase security, phishing attacks, signature verification, hardware wallets, NFT marketplace scams, Web3 social engineering",[1],completed,,User-facing Web3 security
,4,ai_security,2,OWASP LLM01: Prompt Injection Attacks and Defenses,OWASP AI Top 10,"Direct prompt injection, indirect prompt injection, jailbreaking, prompt injection detection, input validation, output filtering, defense-in-depth","[1,2,3]",completed,Course: OWASP LLM Top 10,Critical vulnerability - manipulating LLM behavior through crafted inputs
,5,ai_security,2,OWASP LLM02: Sensitive Information Disclosure,OWASP AI Top 10,"Training data leakage, PII exposure, model inversion attacks, membership inference, data sanitization, differential privacy","[1,2,3]",completed,Course: OWASP LLM Top 10,LLMs may leak sensitive data from training sets or user inputs
,6,ai_security,2,OWASP LLM03: Supply Chain Vulnerabilities,OWASP AI Top 10,"Third-party model risks, plugin security, data poisoning via supply chain, model provenance, dependency management, SBOM for AI","[1,2,3]",completed,Course: OWASP LLM Top 10,"Risks from third-party models, datasets, and plugins"
,7,ai_security,3,OWASP LLM04: Data and Model Poisoning,OWASP AI Top 10,"Training data poisoning, backdoor attacks, adversarial examples, federated learning attacks, data validation, robust training","[1,2,3,4]",completed,Course: OWASP LLM Top 10,Manipulating training data or fine-tuning to compromise model behavior
,8,ai_security,2,OWASP LLM05: Improper Output Handling,OWASP AI Top 10,"XSS via LLM output, injection attacks, unsafe code execution, output validation, sandboxing, content security policy","[1,2,3]",completed,Course: OWASP LLM Top 10,LLM outputs used without proper validation can lead to injection attacks
,9,ai_security,2,OWASP LLM06: Excessive Agency,OWASP AI Top 10,"Over-permissioned LLMs, plugin abuse, unintended actions, principle of least privilege, action validation, human-in-the-loop","[1,2,3]",completed,Course: OWASP LLM Top 10,LLM-based systems granted too much autonomy or dangerous capabilities
,10,ai_security,2,OWASP LLM07: System Prompt Leakage,OWASP AI Top 10,"System prompt extraction, role revelation, instruction leakage, prompt protection techniques, obfuscation, detection","[1,2,3,4]",completed,Course: OWASP LLM Top 10,Attackers extract system prompts to understand and exploit LLM behavior
,11,ai_security,3,OWASP LLM08: Vector and Embedding Weaknesses,OWASP AI Top 10,"RAG poisoning, vector database attacks, embedding manipulation, semantic search bypass, vector store security","[1,2,3]",completed,Course: OWASP LLM Top 10,Attacks targeting vector databases and RAG systems
,12,ai_security,2,OWASP LLM09: Misinformation and Hallucination,OWASP AI Top 10,"LLM hallucinations, factual incorrectness, confidence calibration, source attribution, fact-checking, adversarial misinformation","[1,2,3]",completed,Course: OWASP LLM Top 10,LLMs generating false or misleading information with confidence
,13,ai_security,2,OWASP LLM10: Unbounded Consumption,OWASP AI Top 10,"Denial of service via LLM, resource exhaustion, cost attacks, rate limiting, quotas, circuit breakers, monitoring","[1,2,3]",completed,Course: OWASP LLM Top 10,Resource exhaustion through excessive LLM usage or complex queries
136,23,cloud,1,Cloud Forensics Foundations and Evidence Sources,Section 1: Microsoft 365 and Graph API,"Cloud architecture for DFIR, snapshots and cloud flows, log hierarchy, cloud-specific evidence sources, traditional vs cloud forensics, SOF-ELK introduction",[1],planned,Course: SANS-FOR509,Foundation lesson - introduces key cloud concepts for forensics
137,24,cloud,2,Microsoft 365 Unified Audit Log Analysis,Section 1: Microsoft 365 and Graph API,"M365 Unified Audit Log structure, log retention and collection, audit log search, Exchange Online logs, SharePoint logs, Teams logs, user activity tracking","[23,18]",planned,Course: SANS-FOR509,Critical for M365 incident investigations
138,25,cloud,2,Microsoft Graph API for Forensic Data Collection,Section 1: Microsoft 365 and Graph API,"Graph API fundamentals, authentication and permissions, programmatic log collection, user and mailbox enumeration, sign-in logs via API, automated evidence gathering","[24,18]",planned,Course: SANS-FOR509,API-driven forensic data extraction
139,26,cloud,2,Azure Activity and Diagnostic Logs,Section 2: Microsoft Azure,"Azure Activity Log, diagnostic logs, resource logs, Azure Monitor, log retention policies, log analytics workspace, KQL queries for forensics","[18,23]",planned,Course: SANS-FOR509,Core Azure logging for IR
140,27,cloud,2,Azure Virtual Machine Forensics,Section 2: Microsoft Azure,"Azure VM snapshots for preservation, disk export and analysis, VM extensions for evidence collection, memory capture in Azure, analyzing VM activity logs, VM compromise investigation","[26,19]",planned,Course: SANS-FOR509,Cloud VM forensic techniques
141,28,cloud,2,Azure Storage Account Forensics,Section 2: Microsoft Azure,"Storage account logs, blob access logs, container forensics, storage analytics, shared access signatures (SAS) analysis, data exfiltration detection via storage logs","[26,19]",planned,Course: SANS-FOR509,Azure storage and data exfiltration
142,29,cloud,3,Azure Virtual Network Forensics,Section 2: Microsoft Azure,"VNet flow logs (NSG flow logs), network watcher packet capture, Azure Firewall logs, traffic analytics, lateral movement detection, network topology analysis","[26,27]",planned,Course: SANS-FOR509,Network forensics in Azure
143,30,cloud,3,Deploying Forensic Tools in Azure,Section 2: Microsoft Azure,"Cloud-native forensic analysis, deploying forensic VMs, using Azure compute for analysis, scalable log processing with Azure resources, cost optimization for forensic workloads","[26,27,28,29]",planned,Course: SANS-FOR509,Moving forensic processes to the cloud
144,31,cloud,2,AWS Identity and CloudTrail Fundamentals,Section 3: AWS,"AWS IAM forensics, CloudTrail log structure, API call tracking, authentication and authorization events, CloudTrail insights, federated user compromise detection","[1,23]",planned,Course: SANS-FOR509,Foundation for AWS investigations
145,32,cloud,2,AWS VPC Flow Logs and Network Forensics,Section 3: AWS,"VPC Flow Logs structure, enabling flow logging, analyzing network traffic patterns, accepted/rejected connections, lateral movement detection, egress monitoring","[31,16]",planned,Course: SANS-FOR509,AWS network visibility
146,33,cloud,2,AWS EC2 Instance Forensics,Section 3: AWS,"EC2 snapshot creation, EBS volume forensics, instance metadata analysis, Systems Manager for evidence collection, memory capture from EC2, AMI analysis","[31,32]",planned,Course: SANS-FOR509,EC2 compromise investigations
147,34,cloud,2,AWS S3 Bucket Forensics,Section 3: AWS,"S3 access logs, server access logging, CloudTrail for S3 data events, bucket policy analysis, object versioning for recovery, S3 data exfiltration detection","[31,32]",planned,Course: SANS-FOR509,S3 storage and exfiltration
148,35,cloud,3,AWS Native Log Searching and Analysis,Section 3: AWS,"CloudWatch Logs Insights, Athena for CloudTrail analysis, querying S3 access logs, GuardDuty findings, Security Hub aggregation, automated hunting queries","[31,32,33,34]",planned,Course: SANS-FOR509,Scalable log analysis in AWS
149,112,dfir,3,AWS Intrusion Case Study Lab,Section 3: AWS,"Realistic AWS compromise scenario, federated user account takeover, privilege escalation in AWS, data exfiltration via S3, complete timeline reconstruction, remediation steps","[31,32,33,34,35]",planned,Course: SANS-FOR509,Hands-on AWS incident investigation
150,36,cloud,2,Kubernetes Architecture for Forensics,Section 4: Kubernetes,"Container evolution (hardware to containers), Kubernetes core components (pods, nodes, deployments), control plane and worker nodes, etcd cluster store, API server, namespaces and RBAC","[1,23]",planned,Course: SANS-FOR509,K8s fundamentals for investigators
151,37,cloud,3,Kubernetes Logging and Forensics,Section 4: Kubernetes,"Container logs, kubelet logs, API server audit logs, node logs, persistent volume forensics, kubectl for evidence collection, log aggregation (Fluentd, Elasticsearch)","[36,19]",planned,Course: SANS-FOR509,K8s-specific evidence sources
152,38,cloud,3,Common Kubernetes Attacks and Detection,Section 4: Kubernetes,"Container escape, privilege escalation, misconfigured RBAC, exposed dashboards, cryptomining, supply chain attacks, malicious images, detecting compromised pods","[36,37]",planned,Course: SANS-FOR509,K8s threat landscape
153,39,cloud,2,Google Workspace Audit Logs,Section 4: Kubernetes and Google Workspace,"Admin audit logs, Drive audit logs, Login audit logs, Calendar and Meet logs, log retention, BigQuery export, user activity investigation, data access tracking","[23,20]",planned,Course: SANS-FOR509,Google Workspace forensics
154,40,cloud,2,Accessing Google Workspace Evidence,Section 4: Kubernetes and Google Workspace,"Admin SDK API, Reports API, programmatic log collection, Google Takeout for user data, Vault for eDiscovery, exporting mailboxes, Drive file forensics","[39,20]",planned,Course: SANS-FOR509,GWS evidence collection methods
155,41,cloud,3,Investigating Google Workspace Incidents,Section 4: Kubernetes and Google Workspace,"Account compromise investigation, OAuth token abuse, phishing via Gmail, Drive data exfiltration, suspicious login detection, admin activity analysis, third-party app auditing","[39,40]",planned,Course: SANS-FOR509,Real-world GWS investigations
156,42,cloud,2,Google Cloud IAM and Logging,Section 5: Google Cloud,"GCP IAM model, organizations/folders/projects hierarchy, Cloud Audit Logs (admin activity, data access, system events), log retention, Cloud Logging, IAM policy analysis","[20,23]",planned,Course: SANS-FOR509,GCP logging foundations
157,43,cloud,2,Google Compute Engine Forensics,Section 5: Google Cloud,"GCE instance snapshots, persistent disk forensics, instance metadata, startup scripts analysis, OS Login logs, serial console logs, compromised instance investigation","[42,20]",planned,Course: SANS-FOR509,GCE VM forensics
158,44,cloud,2,Google Cloud Storage Forensics,Section 5: Google Cloud,"Cloud Storage logs, bucket access logs, object versioning, signed URLs analysis, data access audit logs, gsutil for evidence collection, GCS exfiltration detection","[42,43]",planned,Course: SANS-FOR509,GCS data exfiltration
159,45,cloud,3,Google Cloud VPC and Network Forensics,Section 5: Google Cloud,"VPC Flow Logs in GCP, firewall rules and logs, Cloud NAT logs, load balancer logs, network topology analysis, lateral movement detection, packet mirroring","[42,43,44]",planned,Course: SANS-FOR509,GCP network visibility
160,113,dfir,3,Multi-Cloud Intrusion Capstone Challenge,Section 6: Multicloud,"Complex intrusion spanning AWS/Azure/GCP, team-based investigation, evidence across multiple clouds, attack timeline reconstruction, cross-cloud correlation, incident reporting","[23,24,25,26,27,28,29,30,31,32,33,34,35,36,37,38,39,40,41,42,43,44,45]",planned,Course: SANS-FOR509,Final capstone - requires all FOR509 modules
161,114,dfir,1,Windows Forensics Foundations and Data Triage,Section 1: Digital Forensics and Advanced Data Triage,"Windows OS components, core forensic principles, interconnected environments (mobile, tablets, cloud), live response and triage acquisition, forensically sound acquisition techniques",[],planned,Course: SANS-FOR500,Foundation lesson for Windows forensics
162,115,dfir,2,Windows NTFS File System Forensics,Section 1: Digital Forensics and Advanced Data Triage,"NTFS structure and artifacts, MFT analysis, alternate data streams, file system timeline analysis, $LogFile and $UsnJrnl, resident vs non-resident files","[114]",planned,Course: SANS-FOR500,Deep dive into NTFS for forensics
163,116,dfir,2,Windows Image Mounting and File Carving,Section 1: Digital Forensics and Advanced Data Triage,"Image mounting techniques, E01 and forensic image formats, document and file metadata analysis, file signature analysis, stream carving, recovering deleted files","[114,115]",planned,Course: SANS-FOR500,Evidence preservation and recovery
164,117,dfir,2,Volume Shadow Copies and Memory Analysis,Section 1: Digital Forensics and Advanced Data Triage,"VSS forensics, recovering deleted files from shadow copies, historical artifact analysis, pagefile analysis, memory dump analysis, unallocated space analysis","[114,115,116]",planned,Course: SANS-FOR500,Leveraging VSS for historical forensics
165,118,dfir,2,Windows Registry Forensics Core,Section 2: Registry Analysis,"Registry structure (hives), SAM and SECURITY hives, SOFTWARE and SYSTEM hives, user hives (NTUSER.DAT, UsrClass.dat), registry transaction logs, RegRipper and Registry Explorer tools","[114,115]",planned,Course: SANS-FOR500,Foundation for all registry analysis
166,119,dfir,2,Windows User Profiling and System Information,Section 2: Registry Analysis,"User profiles and groups, SID analysis, last logon times, OS version and installation, computer name and timezone, network information, installed programs","[118]",planned,Course: SANS-FOR500,System and user profiling from Registry
167,120,dfir,3,Windows Application Execution Artifacts,Section 2: Registry Analysis,"UserAssist (program execution tracking), Shimcache (AppCompatCache), AmCache.hve, BAM/DAM (Background Activity Moderator), prefetch files, recent file analysis, MUI cache","[118,119]",planned,Course: SANS-FOR500,Tracking program execution and file access
168,121,dfir,3,Cloud Storage Forensics - OneDrive and Google Drive,Section 2: Registry Analysis,"OneDrive personal and business forensics, OneDrive logs and databases, Google Drive artifacts, Dropbox forensics, iCloud artifacts, cloud sync logs, cached content analysis, deleted file history","[114,120]",planned,Course: SANS-FOR500,Modern cloud storage investigation
169,122,dfir,2,Windows Shell Items and ShellBags,Section 3: Shell Items and Removable Device Profiling,"Shell item structure, ShellBags analysis, folder access tracking, LNK file analysis, Jump Lists, recent documents, network share access, MRU lists","[118,120]",planned,Course: SANS-FOR500,Detailed user activity reconstruction
170,123,dfir,3,USB Device and BYOD Forensics,Section 3: Shell Items and Removable Device Profiling,"USB device tracking, USBSTOR registry key, first and last connection times, device serial numbers, volume name and capacity, files accessed on removable media, smartphone forensics artifacts","[118,122]",planned,Course: SANS-FOR500,Comprehensive USB investigation
171,124,dfir,2,Windows Email Forensics,Section 4: Email Analysis,"Outlook PST/OST forensics, Exchange artifacts, MAPI headers, email recovery, webmail artifacts (Gmail, Yahoo), mobile email sync, email on cloud servers, O365 mailbox forensics","[114,121]",planned,Course: SANS-FOR500,Email evidence collection and analysis
172,125,dfir,2,Windows Search Database Forensics,Section 4: Email Analysis,"Windows Search index (Windows.edb), ESE database parsing, indexed file metadata, content indexing, Outlook search, OneNote artifacts, SharePoint indexed content, OneDrive indexed files","[115,118,124]",planned,Course: SANS-FOR500,Mining Windows Search for evidence
173,126,dfir,3,Windows Event Log Analysis,Section 4: Email Analysis,"Event log structure (EVTX format), Security logs (logon/logoff events 4624/4625), System and Application logs, RDP forensics (TerminalServices logs), PowerShell logging, WMI event logs, scheduled task logs","[114,118]",planned,Course: SANS-FOR500,Comprehensive Windows event log analysis
174,127,dfir,2,SRUM and Network Activity Forensics,Section 4: Email Analysis,"System Resource Usage Monitor (SRUM), application network usage, bytes sent/received per application, network connectivity history, WLAN event logs, WiFi geolocation","[118,126]",planned,Course: SANS-FOR500,Network usage and application tracking
